Book	Smell_Word	Smell_Source	Quality	Odour_Carrier	Evoked_Odorant	Location	Perceiver	Time	Circumstances	Effect	SentenceBefore	Sentence	SentenceAfter
bl08026	smell	of the drink		on the warm air|THE POWER			She			steady her shaking nerves	Her hair hung down dishevelled , dishevelled , her hat was tilted on one side of her head , her eyes fixed with a vacuous expression , expression , her under - lip hanging clown , and a smile — God help her ! — such a smile on her miserable miserable face .	She could feel the smell of the drink floating out on the warm air , ancl she 234 THE POWER OF THE PURSE longed for just one drop more to steady her shaking nerves .	At closing time a man issued from the side door .
bl08027	scented	flowers|bushes		the air			He				Gilbert sat silent beside his father , after the first spasm of chatter , and kept his eyes fixed on this handsome face , watching its every expression , every movement .	He was perhaps vaguely conscious of the green lawn , in shadow now , edged all round with flowers and bushes , that scented the air delicately ; of the steps , still in the sunshine , with his father sprawling all his length in a bath of light ; of his dark , quiet mother in the shade of the doorway ; and of the little table laid out with dainty china , one of Mr .	Strode ' s CHAPTER I This was the thoroughfare that Gilbert had passed along for some years every morning and evening ; yes , this was it , teaming with life ; — not the politest .
bl08027	stinking|stinking	the|rag of reality	filthy|stinking|stinking				his				He sat for a full hour one night , thinking apparently , and every minute of this hour traced its mark upon his face .	Once more a tumbling of idols , — no , a selling of them ; once more the filthy , stinking rag of reality was stuck under his nose .	' Oh ! oh ! ' cried his poor , sore heart ' Oh ! oh ! ' yelled the open , empty - mouthed noughts .
bl08027	odours		bad			near the public - house at the corner	him|he				Then instead of doing as sensible people do , and discarding them for something something more solid , Gilbert stuck to his poor ices : they were not very nourishing .	A swish of swing doors , a sudden roar of voices and a gust of bad odours reminded him that he was near the public - house at the corner .	A barman barman came to the door with a half - empty pot in his hand , and asked briskly of a respectable woman outside what she wanted .
bl08027	smell	of pews|Bibles									The drawing - room was a large , handsome room , decorated with palms and a magnificent mantelpiece mantelpiece that caught the eye at once .	A smell of pews hung about it by reason of spare chairs and Bibles being stored in a cupboard there .	Something ominous about this room struck Gilbert the first day he entered it , and he never , even when it became familiar , got rid of the feeling .
bl08027	smelling|smelling	pot of glue	smelling|smelling			on the fire					Still , she suspected that they occurred when he was put out , for he generally looked pained and ill , smoked much , and answered her coldly when she spoke to him .	To - night , with a smelling pot of glue on the fire , newspapers spread on the hearthrug , he turned up his sleeves and investigated investigated the pieces with an absent and gloomy ex - pression .	' You are so neat - handed that I thought you had better do it , but don ' t trouble if you are tired .
bl08027	sniffing						Gilbert				But so many people are miserable .	' Dog ! Is that you ? ' said Gilbert , returning to his chair , and becoming aware of a moist black thing , a sniffing , muzzly , affectionate nose at his elbow .	He embraced the beast with the silly effusion that comes of sitting up late at night , and meditating in solitude over the littleness of life , the coldness and dirtiness of the Thames .
bl08027	fragrance|aroma		peculiar		of					that lingers round remembrances and makes them sweet	' If you get stuck on a pedestal , you must expect expect people to try and see what ' s on the top , ' was UGLY IDOL 28 innumerable fancies ; of the still afternoon landscape landscape beyond , alive with that quiet movement of things that precedes the silence of the evening , that far - away tinkle of cows in the valley , the ' brrrrrri ? ! ' of the peasant to his horses , the last clank of the anvil in the smithy , the busy clatter of sabots in the courtyard , the six - o ' clock Angelus of the Roman Catholic church in the town — perhaps he was aware of it all .	Afterwards Afterwards it came back to him very vividly , all wrapped in that golden sunshine , and with the peculiar fragrance of old things , the aroma that lingers round remembrances and makes them sweet .	The smell of life when it was new ; yes , the smell of it .
bl08027	smell|smell	of life|of it							when it was new		Afterwards Afterwards it came back to him very vividly , all wrapped in that golden sunshine , and with the peculiar fragrance of old things , the aroma that lingers round remembrances and makes them sweet .	The smell of life when it was new ; yes , the smell of it .	.
bl08027	smell	thereof	distasteful				to many				Later , Agatha showed a tendency towards religion , which generally grew stronger after some quarrel with her governess , and which was apt to wane when more interesting matters claimed her attention .	Her father was an Atheist , who , after the fashion of his kind , thrust his theories under all noses , regardless that the smell thereof was distasteful distasteful to many nostrils .	Her mother tolerated complacently a Roman Catholic French nurse and a Protestant English governess , being too indolent to dispense with either until her husband should discover this mixture of creeds .
bl08027	fragrance	the orange - trees	dainty	abroad on the cooling air							Mais voyons , pas de betises — dame ! Mademoiselle , pas si vite , — marchez done a mes cotes , voyons ! ' Jeannette continued to converse in this manner until they reached the drawing - room steps , where Clothilde was sitting , working quietly as usual .	These steps were so wide as to form almost a terrace , and at each end stood the orange - trees , wafting a dainty fragrance abroad on the cooling air .	' Ah ? here ' s M .
bl08027	smell	of dinner	appetising								With that prickly sensitiveness , so annoying to other people , he was afraid on the morrow to hurt his own tender soul or hers .	He turned his key in the door , and on entering entering was met with a pleasant warmth , an appetising smell of dinner , and his wife .	' Are not you rather late ? I wish you would try to be more punctual — it upsets the servants , ' she said , in that extremely good - natured way she had of saying everything , and that took the sting from any reproach .
bl08027	fragrance|aroma	of roses and orangetrees|orangetrees|of new - mown hay|of currants|apples	pervading	the air			he				There was always a little flippant flutter among them , and he wondered what their chattering was all about .	And what a fragrance there was in the air ! he never forgot it , that pervading aroma of roses and orangetrees , orangetrees , of new - mown hay that was almost all flowers , of currants and apples that came from the orchard .	He lay and dreamt all the long summer day on the edge of the river - bank .
bl08027	odours	of gas|cookery	hot				him|him			did not nauseate him|him	Gilbert left the room abruptly , and tore out into the streets seeking refuge in their glare and rattle .	Nothing in the crowd repulsed him ; these loud laughs did not smite his ear rudely , the hot odours of gas and cookery , of many people crowded in small places , did not nauseate him .	He mingled with this Saturday night ' s crowd ; elbow to elbow he hurried along with a creature from whom he would have fled in daylight ; on , on , in this turmoil of a laughing , smoking , cursing crowd ; on , on , through the muck of the gutters .
bl08027	smelt|odours	the hot air|of tobacco|strong wine				from restaurants	he	sometimes			And , ' added the simple soul , with naive frankness , ' I UGLY IDOL 2 of habit he walked every day upon the pavement he had so hated a while ago .	Yet this crowd , coarse , roaring , pushing , swearing , repulsed him still when he awoke to its reality ; sometimes he smelt the hot air from restaurants , the odours of tobacco and strong wine , and heard anew the excited voices and suggestive giggles from within , and turned aside shuddering .	And yet , he thought bitterly , the people that passed him were miserable , like himself ; one , here and there , — that shivering woman , clutching at her meagre black shawl with a bruised hand , — even tragic ; others — that tipsy man , guided by a female urchin in laceless boots — absurd .
bl08027	smell	of it	very							raised a longing in him that was painful	His eye travelled over her UGLY IDOL 64 struck him and stirred him strangely .	He knew that it was an exterior quality only , but he had lived in the midst of it when he was a boy , and the very smell of it raised a longing in him that was painful .	He tingled in response to things that were said around him , and much was said , for every one talked , talked , talked , just the talk to which he liked to listen — bright , effervescent , sometimes clever , always entertaining .
bl08027	smell|scent	of flowers					Gilbert|he				Strode would not have it spoilt by the presence of any English servant .	Gilbert enjoyed these simple things ; but then he was just so high , small enough to smell the scent of flowers , to feel the poetry of things , to have the soul to enjoy them .	Then the Yorkes went away .
bl08028	scent	of white lilac|verbena		the wind							A sudden gust of wind caught one of the petals , drawing it up into the air till the scarlet shewed quite black against the brilliant blue sky .	George watched it swaying unevenly down again , while the wind which had caught it up swept past them , scattering the scent of white lilac and verbena .	Jim nodded approvingly : Well done , Baby ; now I ' ll cut the stalk in two ; I ' ll take it — Who ' s this A man had come through the trees on their left , 28 RICHARD ESCOTT .
bl08028	perfume			The room							In her hand she carried another bunch of roses , and Beatrix came in too , bringing more roses .	The room seemed to be suddenly filled with perfume and colour , and as Villiers looked 69 A GAME OF POKER .	at the children ' s sweet faces a sudden feeling of disgust came over him at the purpose of his visit here to - night .
bl08028	foul|foul smelling|smelling		foul|foul smelling|smelling			its|rooms					97 was nearly two o ' clock , and the famous Chateau Rouge would shortly close its doors .	In its foul smelling rooms the dim light of a few oil lamps showed , sitting at numerous tables , the lowest and most degraded denizens of the Ouartier Latin .	Complete Complete silence reigned .
bl08028	smell						Alford			beginning to feel quite sick	Not seeing the man of whom he was in search , Alford went on into the adjoining room , where , in yet deeper darkness , scores more of men and women were lying on the floor , sleeping off the effects of their night ' s drinking till two o ' clock should strike , and they should be bundled out into the street .	The gas was turned up by an attendant , and Alford passed through as quickly as possible , beginning to feel quite sick with the smell .	He came back into the outer room , and at last , catching catching sight of the man he wanted , moved gingerly across the dirty floor to a table on the far side of the room .
bl08028	scent	of honeysuckle honeysuckle|of wild roses|blackberry flower		breaths of wind							He felt ready and willing to fall in love with her .	Hot breaths of wind laden Avith the scent of honeysuckle honeysuckle blew past , rustling through bracken and hedges full of wild roses and blackberry flower , and sweeping down a long hill till they lost themselves in the heat ALFORD ' S FAILURE .	163 mists below .
bl08028	smell	of laudanum|carbolic|a score of other drugs				the room	Lady Stratton|Nellie				At ALFORD ' S SUCCESS .	191 the same hour Lady Stratton , and then Nellie and Beatrix and Alford , came into the room , which was still filled with the hot , unfreshened night atmosphere , atmosphere , and sickly with the smell of laudanum , carbolic , and a score of other drugs .	Sometimes as his mother and children stood by him , with the fresh , revived air of newly dressed people , as their cool , white hands touched his fevered ones , Richard ' s heart would grow sick with rage against his fate .
bl08028	vapour|smell	White|of sodden vegetation and soaking clay - soil	disagreeable	the air		over the lawn					Sometimes , as a glare of extra light shone out from the furnaces , the bare tree - tops would catch the reflection , and their wet branches glowed red and crimson .	White vapour hung over the lawn , flower - beds , and woods beyond , and a disagreeable smell of sodden vegetation and soaking clay - soil filled the air .	There was a dance apparently at the village inn , for the wind brought strains of dance music from that direction , and Alford , as he listened , thought of the village folk yonder dancing , laughing , joking ; of my Lord Stratton Stratton lying near by him , sick and weary in mind and body ; and then of himself , whom , just at present , he pitied almost as much .
bl08028	scent	of fresh grasses|budding trees		a soft south - west wind							George Escott came with him , going to lunch at the rectory , while Alford went on to the Abbey and to Lord Stratton ' s room .	Spring sunshine , brilliant with life and light , flooded the room ; through wide - open windows a soft south - west wind came laden with the scent of fresh grasses and budding trees , alive with the songs of birds , charged in its very breath with the strong life and force of awakening Nature .	Stratton was sitting up in bed looking so much better that a glow of gratitude , whose intensity astonished himself , filled Alford ' s mind as he came into the room .
bl08028	scented	with deal shavings				The work - shop					He looked up to nod good - afternoon , and then , two or three screws being in his mouth , turned back to his work in silence .	The work - shop was cool and quiet , scented with deal shavings , and possessing many comfortable if unconventional seats .	Its low , wide entrance framed a many - coloured picture in which butterflies , dragon - flies , and bees flew about among a wealth of autumn flowers ; and he would have been hard to please who , on such an afternoon , could not be contented with a couch of sawdust and idle contemplation contemplation of Nature .
bl08030	sniff		resounding resounding								Prepare to meet thy repeated Billy .	The superintendent minister had a way of announcing his text twice before he began to preach , and so , detecting an ambitious imitation , imitation , Sam Speck gave a significant and resounding resounding sniff from behind the choir curtain .	Prepare to meet thy reiterated the preacher with a perceptible quaver in his voice .
bl08030	snuff|snuff			snuff|snuff|box							They ' n five caas , an ' a bullock ha ' na they ? And the clogger suffered further inward humiliation as he replied — Aw tell thi Aw knaw nowt abaat Naa , Jabe , nooan o ' thy But Jabe had perjured himself sufficiently , and commenced hammering an obstreperous clog top as though he would knock a hole through it .	Job had recourse to the snuff - box again , and turning to the fire sat looking into it and ruminating deeply .	Then he got up once more , stepped behind the counter and over to the clog - cutting bench , which stood against the wall at Jabe ' s right hand .
bl08030	scented	tobacco									Ne ' er mind , she said , it ' s an ill wind ' at blows noabry ony good .	Tha ' ll be able ta tak ' me an th ' childer a walk a bit i ' th ' The next Friday she brought him a fancy pipe and a quarter of scented tobacco from Duxbury , and poor Johnty , though his heart was sad , was so entirely under the influence of this little wife of his that at her bidding he smoked the new pipe and tobacco the same night , feeling all the time as if it would choke him .	Mule - minding is piecework , and so , as she never thought of asking , Susy did not know exactly what her husband earned , and the Minder was strongly tempted to keep back CLOG SHOP CHRONICLES 168 more of his wages than he had previously done , and save it up for the dark day he felt sure was coming .
bl08030	fragrant|fragrant	roasted apple	fragrant|fragrant								Johnty made straight for home , and somewhat somewhat roughly demanded his supper .	His plate of porridge was placed before him , and by its side , on a little white plate , was set a fragrant roasted apple , and his wife playfully plucked at his beard and called him owd Grumpy in a merry and altogether irresistible way .	But Johnty was in no mood for sport , and after eating his ' porridge he left the apple as a silent protest against extravagance , and went out again , for if the truth must be told he was afraid to stay alone with his wife just then .
bl08030	scented|scented	weed	scented|scented								She put him in one of her new - fashioned easy chairs , and Jabe admitted to himself that these were easier than the Beckside straight - backs .	Then she got him a pipe , praised her husband ' s scented weed , and playfully compelled compelled him to try it , charging the pipe herself , and even bringing him a lighted When he had got fairly agoing , she rated him teasingly about not having been to see them before , and suddenly remembering something something else , brought him a glass of balm wine , and insisted on his drinking to their happiness .	This unconscious coals - of - fire treatment made Jabe feel very bad indeed ; but just then the baby — a sturdy , young ten months ' old — awoke , and Susy brought him to Jabe to look at , and so bewitched him that , though FOR BETTER , FOR WORSE 185 he had scarcely touched a baby for thirty years , and felt dreadfully afraid of hurting it , he recklessly asked to be allowed to hold it , Susy , as he did so , stepping back and clapping her hands in admiration .
bl08030	whiff		quiet				he				It must , however , be stated , if we are to make a full and faithful record , that the Clogger did not bear his cross either meekly or silently .	Jabe had been busy one day teaching his apprentice the art of clog - sole shaping , and as the work had been trying to both his back A DIPLOMATIC REVERSE 219 and his temper , he was resting and taking a quiet whiff , meditating the while on a little problem which was just then exercising his mind .	Four or five months before , Ralph Green , the cut - looker , had died , leaving a wife and five children unprovided for .
bl08030	whiffs	The smoke|from	rapid								At length she said mildly — Aar Rutchart [ Richard ] thinks a seet o ' thee , Another snort from the Clogger , and a resumption of violent leg exercise .	He ' ll be whoam afoor lung , naa , and ther ' ll be noabry praader on him nor thee , The smoke began to puff from Jabe ' s pipe in short , rapid whiffs .	Didn ' t tha read as he wor thinkin ' o ' settlin ' amung his own souk i ' Beckside , Jabe ? 238 CLOG SHOP CHRONICLES Naa , Aw ' ll tell thee wot , cried the Clogger , rising to his feet and limping to the table , Aw ' st finish this letter , if it dreives me maddlet ; but , mind thee , Aw ' st write noa mooar , nayther fur thee nor yo ' r And with a visage of adamantine resolution , resolution , the Clogger picked up his pen and sat down again before demanding snappishly as he did so — Wot ' s th ' next ? Tell him fur t ' moind wot he ' s doin ' wi * them Lundon wenches .
bl08030	sniff		very demonstrative								The circuit steward from Duxbury , who had come with the minister , and was present as auditor of accounts , then took up the tale .	You know , brethren , this is a box ; simply a box ; and ( with a very demonstrative sniff ) a very musty box CLOG SHOP CHRONICLES 282 Nobody spoke .	A non - resident Trustee , who had also come in the circuit conveyance , next broke in — You know we must move with the times , friends .
bl08030	scent					into the shop					The pipes had all been charged , and Jethro was just opening the conversation , when a carriage was heard to stop outside .	The door opened ; a rustle of silk and a waft of scent came floating into the shop , and the great Madame Bona swept towards the ingle - nook .	Well , gentlemen ; how did you like my song ? she asked , still manifesting signs of emotion .
bl08031	fragrant|fragrant|breath		fragrant|fragrant								Everywhere appeared the proofs and evidences of life .	The winter was over , and now , from the sadness and sterility of its withered age , sprang young and lovely summer clad in sunshine , bediamonded with dew , and fragrant with the breath of flowers .	Jess lay back and looked up into the infinite depths above .
bl08031	odour	of the moonflowers	too strong			near the verandah	he				The old man smiled , jerked the stem of his pipe over his shoulder after her , and winked in a way that , no doubt , meant unutterable things , but which did not convey convey much to his astonished guest , who sat still and said nothing .	Then Bessie rose and bade him good - night in her pleasant voice , and with housewifely care inquired as to whether his room was to his taste , and how many blankets he liked upon his bed , telling him that if he found the odour of the moonflowers which grew near the verandah too strong , he had better shut the right - hand window and open that on the other side of the room .	Then at length , with a piquant little nod of her golden head , she went off , looking , John thought as he watched her retreating figure , about as healthy , graceful , and generally satisfactory a young woman as a man could wish to see .
bl08031	odorous|odorous|breath	of mimosa blooms|the stiff grey leaves	odorous|odorous				They				It was this : she was not an intellectual person , although cer - 190 JESS a beautiful striped butterfly perched deliberately upon the purple grapes ! It was a delightful day and a delightful spot .	They were too far from the camp to be disturbed by its rude noise , and the only sounds that reached their ears were the rippling of running water and the whispers of the wind , odorous with the breath of mimosa blooms , as it stirred the stiff grey leaves on the blue gums .	They were seated in the shade of the little house that Jess had learned to love as she had never loved a spot before , but around them lay the flood of sunshine shimmering like golden water ; and beyond the red line of the fence at the end of the garden , where the rich pomegranate bloom tried to blush the roses down , the hot air danced merrily above the rough stone wall like a million microscopic elves at play .
bl08031	stinks	it			of Englishmen						' ' And so I should , nephew , and so I should , if I had not been detained .	Surely you do not suppose that I would linger in the accursed place ? Bah , ' and he spat upon the ground , ' it stinks of Englishmen .	I cannot get the taste of them out of my mouth .
bl08031	smell	of fire									' Ah ! I recollect .	What is all this smell of fire ? Surely they have not burnt the place ? ' ' Yes , uncle , ' sobbed Bessie , ' they have .	' Silas groaned aloud .
bl08031	perfume	the rose	dangerous							that|apt to confuse confuse the senses and turn the head	He was perfectly innocent of the whole story ; to him she was the young lady who happened to be the sister of the woman he was going to many , that was all .	Why should she not pluck her innocent roses whilst she might ? Jess forgot that the rose is a flower with a dangerous perfume , and one that is apt to confuse confuse the senses and turn the head .	So she gave herself herself full swing , and for some weeks went nearer to knowing what happiness really meant than she ever had before .
bl08031	odour	of ferns|the mimosa flowers	sweet	the heavy air							I have seen many springs and many winters , and have looked down on many sleeping sleeping maids , and w * here are they now ? All dead — all dead , ' and an old baboon in the rocks with startling suddenness barked out ' all dead ' in answer .	Around her were the blooming lilies and the lustiness of springing life ; the heavy air was sweet with the odour of ferns and the mimosa flowers .	The running water splashed and musically fell ; the sunlight shot in golden bars athwart the shade , like the memory of happy days in the grey vista of a life ; away in the cliffs yonder , the rock - doves were preparing to nest by hundreds , and waking the silence with their cooing and the flutter of their wings .
bl08031	odorous|odorous	flowers|green|golden fruit	odorous|odorous								It was very solidly built of brown stone , and , with the exception of the waggon - shed and other outbuildings which were roofed with galvanised iron , that shone and glistened in the rays of the morning sun in a way that w * ould have made an eagle blink , was covered with rich brown thatch .	All along its front ran a wide verandah , up the trellis - work of which green vines and blooming creepers trailed pleasantly , and beyond was the broad carriage - drive of red soil , bordered with bushy orange - trees laden with odorous flowers and green and golden fruit .	On the farther side of the orange - trees were the gardens , fenced in with low walls of rough stone , and the orchard planted with standard fruit - trees , and beyond these again the oxen and ostrich kraals , the latter JOHN HAS AN ESCAPE 93 the room stood a table made of the pretty ' buckenhout ' wood , which has the appearance of having been industriously industriously pricked all over with a darning - needle , and round it were chairs and couches of stinkwood , and seated with rimpis or strips of hide .
