Book	Smell_Word	Smell_Source	Quality	Odour_Carrier	Evoked_Odorant	Location	Perceiver	Time	Circumstances	Effect	SentenceBefore	Sentence	SentenceAfter
bl08083	odor|odor	they	disagreeable|pungent pungent|especially perceptible						when the essences completely evaporate and may be considered free from		304 PETROLEUM .	The rectified products now possess nearly all the properties that render them useful , but no matter how carefully they may have been rectified , they still possess a disagreeable , pungent pungent odor , this being especially the case with the C - , B - , and This odor is especially perceptible when the essences completely evaporate and may be considered free from fat , i .	e .
bl08083	odor|odor|scenting|scenting|perfuming	very|very volatile|volatile oils|oils	agreeable|scenting|scenting						by the addition of very|very volatile|volatile oils|oils		, when a sample evaporates at the ordinary temperature temperature without leaving a perceptible trace — a grease spot — behind .	This odor may be covered by the addition of very volatile oils with an agreeable odor , which is called scenting or perfuming the essences .	It is , however , advisable to render the benzine odorless by subjecting it to chemical purification .
bl08083	odor|odor	of sulphurous acid	acrid|original								Treatment from y2 to 1 hour with y to y per cent , of concentrated sulphuric acid suffices , after which the acid , now of a red - brown color , is drawn off .	The acid product is of a light brown - yellow color and an acrid odor of sulphurous acid , while the original odor has entirely disappeared .	The fluid is then treated with a small quantity of dilute caustic soda solution until it is perfectly MANUFACTURE .
bl08083	odor	of sulphurous acid									The fluid is then treated with a small quantity of dilute caustic soda solution until it is perfectly MANUFACTURE .	305 water - clear and has lost the odor of sulphurous acid .	The caustic soda lye is then drawn off , and the benzine , which clears rapidly , is ready to be filled in vessels for use .
bl08083	aromatic|aromatic	hydrocarbons|hydrocarbons	aromatic|aromatic								308 PETROLEUM .	As far as known these admixtures consist of aromatic hydrocarbons , hydrocarbons , fatty acids and acids of the series CnH , n — 20 „ phenols , tarry matter , sulphur combinations , etc .	The action of the sulphuric acid upon these admixtures differs , they being partially destroyed or dissolved and changed to sulphonic acid combinations , while another portion remains almost entirely unchanged , and is removed only by the subsequent treatment with lye .
bl08083	aromatic|aromatic	hydrocarbons sulphonic acids	aromatic|aromatic								The loss by distillation frequently amounts to from 5 to 8 per cent .	The concentrated sulphuric acid forms with the aromatic hydrocarbons sulphonic acids , and with many non - saturated hydrocarbons direct combinations , combinations , while the tarry matter dissolves in the sulphuric acid and imparts to the fluid a dark brown color .	It has been ascertained ' that the sulphuric acid also withdraws the oxydized oxydized bodies from the distillate , so that by continuing the treatment treatment of the latter with sulphuric acid all the oxygen may be removed from the petroleum ; and if the brown sulphuric acid obtained after treating the distillate be diluted with water , an emulsion is formed upon the surface of which floats an oily fluid containing oxygen which possesses a specific odor , reminding reminding one partially of camphor and also of oil of turpentine .
bl08083	odor	oily fluid containing oxygen	specific		of camphor|of oil of						The concentrated sulphuric acid forms with the aromatic hydrocarbons sulphonic acids , and with many non - saturated hydrocarbons direct combinations , combinations , while the tarry matter dissolves in the sulphuric acid and imparts to the fluid a dark brown color .	It has been ascertained ' that the sulphuric acid also withdraws the oxydized oxydized bodies from the distillate , so that by continuing the treatment treatment of the latter with sulphuric acid all the oxygen may be removed from the petroleum ; and if the brown sulphuric acid obtained after treating the distillate be diluted with water , an emulsion is formed upon the surface of which floats an oily fluid containing oxygen which possesses a specific odor , reminding reminding one partially of camphor and also of oil of turpentine .	In the ordinary treatment of the distillate with sulphuric acid a portion of the organic acids and of the phenoles remains unchanged .
bl08083	smelling|smelling|odor	constituents	bad - smelling|smelling|agreeable		characteristic characteristic of pure hydrocarbons				In purifying the distillates with sulphuric acid|with the use of an excess of sulphuric acid		By removing these admixtures ( the phenoles , acids and tarry substances ) substances ) a nearly colorless petroleum can be obtained , which , however , in time again becomes yellow , which is due to the oxidation of the hydrocarbons by the action of the air .	In purifying the distillates with sulphuric acid the bad - smelling constituents are also destroyed , and with the use of an excess of sulphuric acid petroleum with an agreeable odor characteristic characteristic of pure hydrocarbons may be obtained .	For the chemical purification of the distillates ordinary sulphuric sulphuric acid of 66 ° Be .
bl08083	chromates|deodorize	potassium permanganate|chloride of lime|chloride of tin|nitric acid|other chemicals									As a substitute for sulphuric acid various reagents are used .	Thus the chromates , potassium permanganate , chloride of lime , chloride of tin , nitric acid and other chemicals purify and bleach as well as deodorize petroleum .	However , the high price of these reagents prevents their introduction in the practice as a 312 PETROLEUM .
bl08083	odor	of sulphurous acid		the distillate				At this stage			lyeagitator .	At this stage the distillate has an odor of sulphurous acid and a peculiar red - blue fluorescent color , due to its own color and the very finely - divided tarry particles suspended in it .	Washing after acidulating is generally effected by treating the acid distillate with large quantities of water .
bl08083	odor		not disagreeable								The actual process of purifying may now be considered finished .	The refined product is a fluid of a yellow to white color , transparent or turbid from water held in suspension , and possesses possesses an odor which is not disagreeable .	It may be con - MANUFACTURE .
bl08083	odor	The	disagreeable acrid								Both contain in solution or chemically fixed the constituents withdrawn from the distillate .	The waste or sludge acid is a tarry fluid of a light brown to black color and a disagreeable acrid odor which is largely due to sulphurous sulphurous acid .	It is the most disagreeable and troublesome waste product , its further utilization in the refinery itself being difficult and limited .
bl08083	odor		disagreeable						after being for some time treated with the lye		The action of the lye upon the distillate is , under these conditions , actually surprising .	The crude distillate of a dark color and disagreeable odor is entirely entirely changed after being for some time treated with the lye .	It represents a fluid of a light color and slight odor , while the lye used has been converted into a fluid of a brown - black color and bad odor .
bl08083	odor|odor	It|the lye	slight|bad								The crude distillate of a dark color and disagreeable odor is entirely entirely changed after being for some time treated with the lye .	It represents a fluid of a light color and slight odor , while the lye used has been converted into a fluid of a brown - black color and bad odor .	This distillate can be treated better and with less acid after the lye has performed a portion of the work of the acid by withdrawing a great part of the tarry matters ( acid , phenoles , sulphur combinations , etc .
bl08083	odor	It	empyreumatic								It represents , as a rule , a thickly fluid mass of a dark green to black - brown color , and frequently congeals at the ordinary temperature .	It has an empyreumatic odor , frequently reminding reminding one of creosote .	Its specific gravity , as a rule , varies between between 0 .
bl08083	odor|smelling|smelling	green|green|black - brown residuum	slight|disagreeably smelling|smelling	green|green fluid							The oil is allowed to stand for some time longer to allow particles of tar held in suspension to deposit , deposit , when it is drawn off , immediately treated with lye and boiled bright in broad shallow pans .	By this treatment a green fluid of slight odor , transparent in thin layers , and of great lubricating power , is obtained from the disagreeably smelling black - brown residuum .	The expense of producing such oil is however considerable , since by the treatment with acid ( generally ( generally from 5 to 10 per cent .
bl08083	odor		disagreeable								Although with careful distillation a product of a beautiful color and sufficiently sufficiently high specific gravity was obtained , it did not possess the principal requisites of a good lubricating oil , it losing much of its lubricating power by the manner of distillation .	Very high temperatures were required for vaporization , and the oil - vapors coming in contact with the over - heated sides of the still suffered partial decomposition , with the formation of lighter hydrocarbons , hydrocarbons , which decreased the fatness of the oil and imparted to it a disagreeable odor .	To avoid these evils it was endeavored to destroy , or at least decrease the odor by the use of more chemicals , chemicals , and to convert the oil into a tolerably useful commercial article by the addition of vegetable and animal oils .
bl08083	odor	pyrogenous products	bad								The superheated steam acts mechanically , the object of using it being not so much to effect vaporization , which it is not capable of accomplishing on account of its comparatively comparatively low temperature , as to carry along particles of oil and by enveloping them to protect them from suffering decomposition decomposition on the hot walls of the still .	The oil thus retains its lubricating power , and there is no inducement for the formation of pyrogenous products with a bad odor .	The steam may be used either directly from the boiler as saturated steam with a pressure and temperature corresponding with those of the boiler , or as superheated steam .
bl08083	odor	The									Sheet iron stills were then successfully introduced ; they being thinner , all the above described evils could be avoided .	The oils obtained were fatter and lighter , but not free from odor .	The principal reason for the latter defect was the use of upright stills , the distance the oil vapor had to ascend being disproportionately disproportionately large to the vaporizing surface .
bl08083	aromatic|aromatic	non - saturated hydrocarbons	aromatic|aromatic								polymerism .	The distillates obtained by cracking have unfortunately not yet been subjected to examination , but it would seem to be incorrect to consider them as consisting of the same hydrocarbons hydrocarbons as those obtained from crude petroleum , they being very likely richer in aromatic and non - saturated hydrocarbons .	The cracking process based upon decomposition with the assistance of hot iron may be explained by experiments of Letny , Ragosin and others .
bl08083	aromatic|aromatic	hydrocarbons	aromatic|aromatic								A similar process must take place in cracking heavy oils .	The cracking still heated to a gentle red heat may be considered a large pipe in which the heavy oils suffer decomposition by coming in contact with it , and form , though not to the same extent as in the abovementioned abovementioned experiment , a considerable percentage of aromatic hydrocarbons .	That the hydrocarbons formed by the cracking cracking process have a different chemical composition from those occurring in crude oil is also proved by their behavior when subjected to treatment with sulphuric acid and lye .
bl08083	odor	Petroleum prepared|prepared	stronger|dark						prepared|prepared from such		changeable and inferior in quality notwithstanding the most careful treatment .	Petroleum prepared from such oil has a stronger odor , becomes dark very rapidly and possesses but little burning power .	Nevertheless the cracking process is an indispensable indispensable part of the manufacture of petroleum , because it offers the means of realizing in a lucrative manner from residuum residuum otherwise difficult to utilize , and of increasing the yield of petroleum .
bl08083	smell|smell|smell	Naphtha|burning oil|its|lubricating oils	keen|persistent|less pungent|very little								from the others .	Naphtha is a colorless , thin , bright liquid , with a keen , persistent smell ; burning oil is colorless or slightly yellow , more oily than naphtha , but still thinner than water , its smell is less pungent ; lubricating oils are yellow , oily and have very little smell .	Paraffine is a white solid .
bl08083	smell	the|the wax	unpleasant	the|the							The cakes are then turned out , wrapped in canvas and again pressed between iron - plates in a hydraulic press .	These operations are repeated twice or three times until the paraffine assumes the necessary degree of whiteness , after which it is melted up in a still , and steam is blown freely through it to carry off the traces of naphtha , which , if left in it , would give the wax an unpleasant smell - The melted paraffine is finally stirred with bone black , filtered through paper , and run into cooling tins or candle moulds .	In this country paraffine is wholly a by - product in the manufacture manufacture of lubricating oils or in the treatment of the heavy oils proceeding from the distillation of petroleum towards the last of the process .
bl08083	odor	Paraffine|alabaster|alabaster			resembles resembles spermaceti						The paraffine in the filtering box is occasionally drawn off into moulds or boxes of various sizes and allowed to cool slowly .	Paraffine is a colorless , waxy , or foliated crystalline , alabaster - like , alabaster - like , semi - transparent mass without odor or taste , and resembles resembles spermaceti .	It is slippery but not greasy to the touch , and is softened by the warmth of the hand so that it can be kneaded .
bl08083	odorous|odorous	It|compounds	odorous|odorous								840 and boiling not below 68o ° F .	It should be free from colored , fluorescing and odorous compounds .	When heated for a day with sulphuric acid by means of a water bath , it should not become dark colored , colored , and the sulphuric acid should become only slightly brownish .
bl08083	odor	of illuminating oils	slight|disagreeable|disagreeable								Odor .	The odor of illuminating oils should be slight and not disagreeable , disagreeable , or still better , should be entirely absent .	A penetrating , disagreeable odor , such as is possessed by many varieties of commercial petroleum , is due to constituents of the crude oil , which have not been entirely removed in refining .
bl08083	odor		penetrating|disagreeable								The odor of illuminating oils should be slight and not disagreeable , disagreeable , or still better , should be entirely absent .	A penetrating , disagreeable odor , such as is possessed by many varieties of commercial petroleum , is due to constituents of the crude oil , which have not been entirely removed in refining .	refining .
bl08083	odorless|odorless	Lubricating oils	odorless|odorless								refining .	Lubricating oils should be odorless .	A disagreeable odor of lubricating oils is due either to defective distillation or insufficient insufficient treatment with the customary chemicals , sulphuric acid and lye .
bl08083	odor	of lubricating oils|acid|lye	disagreeable								Lubricating oils should be odorless .	A disagreeable odor of lubricating oils is due either to defective distillation or insufficient insufficient treatment with the customary chemicals , sulphuric acid and lye .	1 Behavior towards Sulphuric Acid .
bl08083	odor	of many crude oils and illuminating oils|non - saturated hydrocarbons	disagreeable								) and the petroleum separates rapidly from water .	To test lubricating oils , mix by frequent shaking equal 1The disagreeable odor of many crude oils and illuminating oils is chiefly due to non - saturated hydrocarbons which are completely absorbed by the sulphuric acid , and hence remain behind with defective refining .	( Kast and Lagai .
bl08083	odor	of soap	perceptible perceptible								All stirring or shaking in heating and cooling cooling must be avoided .	On he ; ' - 9 - oils with over 10 per cent , of fat oils a perceptible perceptible odor of soap makes its appearance , which remains after cooling .	The bubbles of gas and air escaping from the sodium or sodium hydroxide disappear immediately with pure mineral oil , while , in the presence of fat oils they remain as a rule after cooling , the walls of the bubbles acquiring a certain coherence from the soap formed .
bl08083	smell		peculiar empyreumatic						the congealing congealing of the liquid on cooling		547 utes .	The presence of larger quanities of fat oil is detected by the peculiar empyreumatic smell given off , and by the congealing congealing of the liquid on cooling .	There being seldom less than 10 per cent , of fat oil present this , in most cases , ends the test .
bl08083	odor	Petroleum									Use of petroleum for illuminating purposes .	Petroleum possessing the great advantages of an almost inexhaustible inexhaustible supply and consequent cheapness , of burning without without smoke or odor and yielding a beautiful light , has caused such a revolution in artificial lighting that the use of vegetable and animal oils for that purpose has been almost entirely abandoned .	abandoned .
bl08083	aromatic|aromatic	bodies	aromatic|aromatic								mentioned .	Production of aromatic bodies from residuum .	By the action of high temperatures naphtha residuum under goes far - reaching changes ; at a red heat aromatic hydrocarbons , naphthalene and anthracene , are formed from it .
bl08083	aromatic|aromatic	naphthalene|anthracene	aromatic|aromatic						at a red heat		Production of aromatic bodies from residuum .	By the action of high temperatures naphtha residuum under goes far - reaching changes ; at a red heat aromatic hydrocarbons , naphthalene and anthracene , are formed from it .	However , such transformations are always accompanied by the separation of coke and evolution of gas .
bl08083	aromatic|aromatic	hydrocarbons	aromatic|aromatic								Letny obtained a patent for the production o .	aromatic hydrocarbons from naphtha .	Soon afterwards this matter was more thoroughly investigated by Liebermann and Burg , Wichelhans and Salzmann , and also by Lissenko .
bl08083	aromatic|aromatic	hydrocarbons|hydrocarbons	aromatic|aromatic	hydrocarbons|hydrocarbons							Soon afterwards this matter was more thoroughly investigated by Liebermann and Burg , Wichelhans and Salzmann , and also by Lissenko .	The yield of aromatic hydrocarbons from residuum depends chiefly on the temperature and next on the uniform supply of residuum to the pipes in which decomposition is effected .	The superheating of the residuum may be effected so that the tar formed is to contain larger quantities of liquid and solid hydrocarbons .
bl08083	aromatic|aromatic		aromatic|aromatic								executed .	When decomposition is effected in the presence of good conductors of heat , the yield of tar , as well as of aromatic hydrocarbons , is much larger .	Laboratory experiments have proved copper filings to be most suitable for the purpose .
bl08083	aromatic|aromatic	hydrocarbons	aromatic|aromatic								208 .	factories in Russia , many attempts have recently been made to obtain aromatic hydrocarbons in paying quantities from residuum residuum ; the gas evolved thereby is to be utilized for illuminating and heating purposes , for driving motors , etc .	USES AND PROPERTIES OF PETROLEUM .
bl08083	aromatic|aromatic	hydrocarbons	aromatic|aromatic								597 Fig .	208 shows an apparatus for the production of gas and tar containing aromatic hydrocarbons , which was exhibited , in 1889 , by Intschik at the St .	Petersburg Exhibition for Illuminating Illuminating Articles and Gas Industry .
bl08083	aromatic|aromatic	hydrocarbons	aromatic|aromatic								USES AND PROPERTIES OF PETROLEUM .	599 By this mode of construction it is claimed the residuum can be converted without a great consumption of fuel into tar - products tar - products rich in aromatic hydrocarbons .	Utilization of petroleum and petroleum products as fuel .
bl08083	odor	the imperfectly prepared oils	disagreeable				them				The hydro - carbon oils , for the purpose of lubrication , lubrication , were at first received with but little favor ; indeed , the opposition opposition was all but universal .	The disagreeable odor always associated with the imperfectly prepared oils first offered , disinclined disinclined superintendents of mills and factories to give them a trial , even at prices much lower than those which they were accustomed accustomed to pay .	Insurance companies , on account of the explosible explosible inflammable vapors , said to be inseparably connected with them , refused to take risks , except at greatly increased rates , upon factories where they were employed .
bl08083	odor	American oils									The lighter Russian oils possess a bluish , and the American oils a greenish , fluorescence .	American oils , almost without exception , are distinguished , as compared with Russian oils , by a better odor and taste , and greater purity of color .	They also show less inclination to volatilization , and consequently are of greater constancy .
bl08083	odor|odor	petroleum	petroleum|peculiar pine						poisoned with petroleum|when boiled with nitric acid		According to Lewin ' s experiments experiments on animals an injurious effect upon the organism is produced only by residuum and heavy oils .	The urine of rabbits poisoned with petroleum showed a petroleum odor , but did not contain unchanged petroleum ; when boiled with nitric acid a peculiar pine odor appeared .	After repeatedly introducing introducing petroleum into the organism albumen appeared in the urine , and when treated with nitric acid a resinous body separated separated which can be extracted with ether and is very probably a changed petroleum product .
bl08083	odor		empyreumatic								This residuum residuum is brought into settling tanks , heated by steam to keep their contents in a liquid state .	After the complete separation of the fine coke it is withdrawn from these tanks and passed through the bone - black cylinders , during which process the color is nearly all removed , as well as the empyreumatic odor .	The manufacturers of petroleum ointment in Germany , who use the term vaseline almost exclusively to designate the product , product , employ as raw material mineral tar , a kind of soft native bitumen from Alsace and Galicia , and residues of American petroleum petroleum which are of a semi - liquid or unctuous condition and yield a correspondingly softer or denser vaseline .
bl08083	odorless|odorless|odor	It|of petroleum	odorless|odorless|faint						when rubbed upon the hand|when melted in water|on melting in water		tasteless .	It is also odorless , not only when rubbed upon the hand , but also when melted in water ; the latter property distinguishing distinguishing it from all other varieties , which , on melting in water , evolve a faint odor of petroleum .	When melted , it yields a clear colorless colorless liquid which , on cooling , returns to its former homogeneous homogeneous condition .
bl08083	scented|scented|perfuming	methyl|ethyl|propyl|butyl|amyl|other alcohols	sweet|scented|scented	ethers							The fatty acids formed may be separated by distillation in vacuum .	The most volatile acids yield , especially with methyl , ethyl , propyl , butyl , amyl and other alcohols , sweet - scented ethers for perfuming purposes .	The acids boiling at higher temperatures form with glycerin combinations resembling natural oils , while the acids boiling at the highest temperature yield soaps and fats .
bl08083	odor	the petroleum	disagreeable|bad	Candles			them				Petroleum with fats or fatty acids which are boiled with water of ammonia or ammoniacal salts is used , or ammonia gas is introduced introduced into a solution of fatty acids in petroleum .	Candles prepared from this mass have the defect of the petroleum vaporizing vaporizing from them , thus imparting to them a disagreeable odor and bad appearance .	Coating with varnish ( amber or copal varnish ) produced only a temporary effect , the varnish being gradually dissolved in the oil .
bl08083	perfumed|perfumed		perfumed|perfumed	oils							655 and wax .	The requirements of the market and especially the numerous adulterations for which petroleum products are used , have brought about the production of lustreless and perfumed oils .	Mineral oils , even those which are but slightly colored , always show a more or less strong fluorescence , which , according to their derivation , is greenish or bluish .
bl08083	odor	They|their	characteristic petroleum								By this fluorescence they can be readily recognized , and it is therefore difficult to use them as an addition to olive or rape oil , and for the production production of artificial fish - oil .	They are also readily recognized by7 their characteristic petroleum odor .	For the removal of the lustre and odor various means are used .
