Book	Smell_Word	Smell_Source	Quality	Odour_Carrier	Evoked_Odorant	Location	Perceiver	Time	Circumstances	Effect	SentenceBefore	Sentence	SentenceAfter
bl08055	odour		very good				we				As to the Commons , I had no great occasion to be particular about my duties in that quarter .	To say the truth , we were getting in no very good odour among the tip - top proctors , and were rapidly sliding down to but a doubtful position .	The business had been indifferent under Mr .
bl08055	snuffed	the two									If you please , I said , I am to sell this for a fair Mr .	Dolloby — Dolloby was the name over the shop - door , at least ; — took the waistcoat , stood his pipe on its head against the door - post , went into the shop , followed by me , snuffed the two candles with his fingers , spread the waistcoat on the counter , and looked at it there , held it up against the light , and looked at it there , and ultimately said : What do you call a price , now , for this here little ! you know best , I returned , modestly .	I can ' t be buyer and seller said Mr .
bl08055	smell	the flowers									It contained quite a show of beautiful geraniums .	We loitered along in front of them , and Dora often stopped to admire this one or that one , and I stopped to admire the same one , and Dora , laughing , help the dog up childishly , to smell the flowers ; and if we were not all three in Fairyland , certainly / was .	The scent of a geranium leaf , at this day , strikes me with a half comical , half serious wonder as to what change has come over me in a moment ; and then I see a straw hat and blue ribbons , and a quantity of curls , and a little black dog being held up , in two slender arms , against a bank of blossoms and bright leaves .
bl08055	scent	of a geranium leaf					me	at this day			We loitered along in front of them , and Dora often stopped to admire this one or that one , and I stopped to admire the same one , and Dora , laughing , help the dog up childishly , to smell the flowers ; and if we were not all three in Fairyland , certainly / was .	The scent of a geranium leaf , at this day , strikes me with a half comical , half serious wonder as to what change has come over me in a moment ; and then I see a straw hat and blue ribbons , and a quantity of curls , and a little black dog being held up , in two slender arms , against a bank of blossoms and bright leaves .	Miss Murdstone had been looking for us .
bl08055	smell		cold|cold					dark nights	when we were rung out of bed|when we were rung into bed		He was taken ill in the night — quite prostrate he was — in consequence of Crab ; and after being drugged with black draughts and blue pills , to an extent which Demple ( whose father was a doctor ) said was enough to undermine a horse ' s constitution , received a caning aud six chapters of Greek Testament for refusing to confess .	The rest of the half - year is a jumble in my recollection of the daily strife and struggle of our lives ; of the waning summer and the changing season ; of the frosty mornings when we were rung out of bed , and the cold , cold smell of tho dark nights when we were rung into bed ; of the evening schoolroom dimly lighted and indifferently warmed , and the morning schoolroom which was nothing but a great shivering - machine ; of the alternation of boiled beef with roast beef , and boiled mutton with roast mutton ; of clods of bread - and - butter , dog ' s - eared lessonbooks , lessonbooks , cracked slates , tear - blotted copy - books , canings , rulerings , hair - cuttings , rainy Sundays , suet puddings , and a dirty atmosphere of ink surrounding all .	I well remember though , how the distant idea of the holidays , after seeming for an immense time to be a stationary speck , began to come towards us , and to grow and grow .
bl08055	smelling			bottle		Miss Mills ' s work - box	I				I besought her to look up .	I ravaged Miss Mills ' s work - box for a smelling - bottle , and iu my agony of mind applied an ivory needle - case instead , and dropped all the needles over Dora .	I shook my fists at Jip , who was as frantic as myself .
bl08055	smell	of fire				there					If tho bed is ready , we ' ll take him up to Janet reported it to be quite ready , I was taken up to it ; kindly , but in some sort like a prisoner ; my aunt going in front , and Janet bringing up the rear .	The only circumstance which gave me any new hope , was my aunt ' s stopping on the stairs to inquire about a smell of fire that was prevalent there ; and Janet ' s replying that she had been making tinder down in the kitchen of my old shirt .	But there were no other clothes in my room than the odd heap of things I wore ; and when I was left there , with a little taper which my aunt forewarned me would burn exactly five minutes , I heard them lock my door on the outside .
bl08055	smelling	deal|of fat				at the upper end of a long bare dining - room	Mell and I				How vividly I call to mind the damp about the house , the green cracked flagstones in the court , an old leaky water - butt , and the discolored trunks of some of the grim trees , which seemed to have dripped more in the rain than other trees , and to have blown less in the sun ! At one we dined , Mr .	Mell and I , at the upper end of a long bare dining - room , full of deal tables , and smelling of fat .	Then , we had more tasks until tea , which Mr .
bl08055	smell|odour	of cake|of Miss Murdstone ' s dress|our black clothes	sweet								DAVID COPPERFIELD .	79 sweet smell of cake , the odour of Miss Murdstone ' s dress , and our black clothes .	Mr .
bl08055	smelling	a|garden	deliciously								I needed no second permission ; though I was by this time in such a state of consternation aud agitation , that my legs shook under me .	I followed the young woman , and we soon came to a very neat little cottage with cheerful bow - windows : in front of it , a small square gravelled court or garden full of flowers , carefully tended , and smelling deliciously .	This is Miss Trotwood ' s , & # 34 ; said the young woman .
bl08056	odour	their	such|terrible								The bears were taking their final meals of rotting salmon before saying good night .	The salmon themselves were well - nigh extinct in the rivers ; their carcases strewed the banks , lay in festoons on every branch along the water ' s edge , and diffused such a terrible odour that nothing but the abundance of mallards up the whole length of the river would have tempted me ( as it did , and to which I yielded ) to follow the course of the stream .	I take the opportunity of here inserting some interesting interesting particulars about these salmon , from the observations of Mr .
bl08056	stench	of the bilge - water									companions .	For days together the wheel was lashed , and we lay , with hardly a stitch of canvas showing , hove - to in furious hurricanes of wind , shut in below with the stench of the bilge - water .	How thankful I was at last to arrive at San Francisco , after a passage passage which seemed a lifetime , but endured in reality for just fifteen days ! With reference to the murder the following extract is from a San Francisco evening paper : — company company consisted of Messrs .
bl08056	odour	of petroleum	rich rank			the streets|everything					As we steamed into the station the Imperial train was just steaming out on the way to visit the natural fire temple of the ancient fire - worshippers at Sulhakhane , Sulhakhane , which had been arranged in its ancient style with some Parsees specially imported for the occasion .	Wonderful was the crowd which thronged the streets ; the rich rank odour of petroleum , as might be expected , pervaded everything ; Bussian officers and officials of every grade in uniform ; Georgians Georgians and Transcaucasians in picturesque attire , with long hair , several daggers in the belt , and a row of ammunition pockets across the breast ; Turkomans with great sheepskin bonnets ; and Persians in tall black lambswool hats .	In the evening the town was illuminated , the letters A M being almost the sole and universal design .
bl08056	scent|smell	Bears|their	very keen				their|an average Indian				All his life is spent among snows and glaciers , hence his polar characteristics .	Bears as a rule are difficult to find owing to their powers of scent , though it must be allowed that it would not be necessary that their sense of smell should be very keen in order to wind an average Indian in his blanket .	When they are caught sight of on the Alaskan mountains they are usually going or coming like a locomotive , as A RIDE TO TEHERAN IN 1888 .
bl08056	stench	dead bodies of salmon	appalling			The bank					Here , in one little rivulet , is fish enough for an army .	The bank is carpeted with dead bodies of salmon , and the stench is appalling .	In the deeper parts long processions swim up and down without any fear of the canoe , in which I frequently , frequently , when the tide was in , ascended the river for a considerable distance .
bl08056	sniff|fragrance	of the incense	holy								He will have the advantage of being in a lighted part of the chapel , while the corner whence he had hoped to observe unnoticed unnoticed is bathed in the deepest gloom , and the disadvantage disadvantage of not being able to escape without exciting attention .	He will possibly have a struggle to maintain an unmoved countenance when he sees all the inhabitants of the monastery , monks , caloyers , servants , priests , pressing forward to kiss a little picture of the saint , whose festa it may be on the morrow , or bowing forward to sniff as much as possible of the holy fragrance of the incense which the acolyte comes round swinging before each of them in turn , or in turn prostrating themselves many times in succession and touching with their foreheads the pavement before the high altar .	349 AMONGST THE WILD GOATS OF THE CASCADES .
bl08056	scent	of those	game	the wind		on the windward side					But during the whole of our operations an immense amount of time was wasted in endless and incomprehensible discussions among the natives .	At last ten guns were posted round the head of the valley , the wind blowing straight across , and thus giving the game scent of those on the windward side .	In about an hour and a half the yells of five beaters commenced , all being apparently at the bottom of the valley at first .
bl08056	odour	of cooking|hawks|crows|vultures	diffused							brought an uneasiness to	partly punting , partly towing , the rather unwieldy craft .	Kassim Ali Khan followed in a smaller boat behind , which formed the kitchen ; and at meal - times , which signified the uncertain periods when I was assailed by pangs of hunger , and shouted for hazri , tiffin , or khana , the two were brought together , and dishes might have been observed passing from one boat to the other , whilst a diffused odour of cooking brought an uneasiness to the kites , hawks , crows , vultures , and even eagles , whose number was legion .	At other times several of the latter , five in all , were shot with my Express as we came upon them noiselessly , seated on the snow near the bank , looking out for some chance morsel or dead fish carried down by the current , the rest of the country being .
bl08056	scent	their	keen				The animals|us				from some branch with a low hiss and a thud .	The animals had winded us with their keen powers of scent , or had heard us , and the deep lane they had made behind them showed them to have left somewhat hurriedly .	The track they had ploughed up led downwards into the forest on the opposite side of the ridge to our camp , and caused me to reflect as to how in the world we were to ascend again through such deep snow if we once left the ridge , until I remembered remembered it would be possible to make a circuit round the mountain from below ; so down we plunged along the deep rut left by the barasingh , and very soon the same coolie sighted them again .
bl08056	scent	our									In the unexpected suddenness of his attack and the excitement of almost my first really large fish , 276 TEN YEARS TRAVEL AND SPORT IN FOREIGN LANDS .	by our scent .	The moment has arrived .
bl08060	smelt	the flesh					the wolves				While on the great Indian war - trail they killed a buffalo , and thenceforth lived on its jerked meat .	One night the wolves smelt the flesh , and came up to the camp - fire ; the strong hunting - dogs rushed out AAdth clamorous barking to drive them aAvay , and the sudden alarm for a moment made the sleepy wayfarers wayfarers think that roving Indians had attacked them .	When they reached Crab Orchard their dangers were for the moment past ; all travellers greAV to regard with affection the station by this little grove of vsdld apple - trees .
bl08060	fragrance	the bloom					the early settlers settlers	in spring			When they reached Crab Orchard their dangers were for the moment past ; all travellers greAV to regard with affection the station by this little grove of vsdld apple - trees .	It is Avorthy of note that the early settlers settlers loved to build their homes near these natural orchards , moved by the fragrance and beauty of the bloom in spring .	1 The tired Baptist was not overpleased with Harrodstown , Harrodstown , though he there listened to the preaching of one of his oavu sect .
bl08060	fragrance	Henderson ' J Reaches|the snoAvy flowers		the air							In the gloomy and ferocious wars that ensued , the wrongs done by each side were many and great .	Henderson ' s company came into the beautiful Kentucky Kentucky country in mid - April , when it looked its best : the trees were in leaf , the air heavy with Henderson ' J Reaches fragrance , the snoAvy flowers ot the dog - Boonsbor - WOod whitened the woods , and the banks of the streams burned dull crimson with the wealth of red - bud blossoms .	The travellers reached the fort that Boon was building on the 20th of the month , being welcomed to the protection of its wooden walls by a volley from twenty or thirty rifles .
bl08063	odour		delicious|appetizing								Driver , every inch of whose AN ISLAND PRINCESS .	131 a pale golden brown , and give forth a delicious and appetizing odour .	Old Sarah , meanwhile , had made the coffee and boiled the milk ; and when all was ready Jean served him with both , refusing even then ( though without her previous acerbity ) to let him wait on or help her , and bringing her own plate and cup to the fender , where she perched , herself for the enjoyment of her meal , clapping her hands as gleefully as a child when Fenwick so far testified to his appreciation of the damper as to hold out his plate for a second smoking wedge from the griddle .
bl08063	fragrance	of scarlet geraniums|from their leaves		by|by the|the evening|evening air|air			he		stirred by|by the|the evening|evening air|air		240 house , and entered the little parlour where Jean and he had passed so many happy hours .	It was almost dark in there — for the window was small , and filled up by a great stand of scarlet geraniums , the fragrance from their leaves just stirred by the evening air — and at first he thought the room was empty ; then something rose up suddenly out of the dimmest corner , a slender figure with white , shadowy face and stretched - out hands , and Keith said hoarsely , Jean , come to and took it in his arms , and let it cling to him as though nothing , not even death , should ever tear it away .	Neither of them spoke .
bl08063	odour	of diddledee bushes|its	fragrant resinous	the air							The ride was a pleasant one , though longer than needful , owing to the broken hilly ground , tunnelled by innumerable rabbit - warrens , and crossed by neither road nor track , which they had to traverse , while every now and then they had to diverge out of the direct route in order to skirt round some impassable stone run or treacherous morass .	Jean was guide , and led the way gallantly , with Keith on one side , and the two middies jostling each other for the post of honour on the other ; and by the time that they reached their halting - place , it was really not unpleasant to find the faithful Wanklyn there before them , with the luncheonhampers luncheonhampers planted in a bed of ferns under the sunny side of a great pile of rocks , and hard by a bright fire of diddledee bushes filling the air with its fragrant resinous odour , and supporting a couple of iron calderas ready AUTUMN ANNOUNCEMENTS .	7 Merchant resident in London .
bl08064	stinking|stinking	grease	stinking|stinking								He was allowed to take back his purse , put it in his pocket , when once more came the order , — ' Shake hands with her .	' He seized the black girl ' s 96 LLFE IN AFRIKANDERLAND hand and shook it heartily , only to drop it in disgust , and call for soap , muttering something about , ' This is too much , shaking hands with the dirty , greasy thing ; soap will hardly wash the stinking grease off my hand again .	' The others were lying on their backs shaking with laughter , and holding their sides .
bl08064	stink	the Boer|his					in the nostrils of the English and European public				Ah ! this cowardly , strike - a - man - behind - hisback , strike - a - man - behind - hisback , blacken - a - dog ' s - name - and - then - kill - him , Boer - hating , Boer - hating , anti - freedom , anti - republican organisation knew well that England can yet boast of millions of honest , fairminded fairminded and well - meaning people , who would not allow a free , peace - loving and God - fearing people to be trampled under foot by a speculating , company - mongering , Matabele - exterminating Matabele - exterminating organisation .	For this reason , the Boer must first be blackened , his name must be made to stink in the nostrils of the English and European public .	It must be made to appear a great deed of chivalry to exterminate these women - killing ( ? ) , slavedealing slavedealing ( ? ) .
bl08064	reeking|reeking reeking	native	reeking|reeking								, etc .	The most ridiculous statement of all was that the Boers ravished the native women ! Anybody knowing a Boer would know how impossible this is ! A Boer shrinks from touching the hands of the dirty , oily , reeking reeking native ; how much more would he shrink from embracin ga .	native woman ! As we have said , Steve had been to the Malaboch war himself .
bl08064	scent						the reader				— Third Edition .	book is a tortuous and mazy tale of mystery , very ingenious in throwing throwing the reader off the scent while luring him on through a cleverly woven web of mystery , which is only unravelled in the very last — St James ' s Budget .	Supplementary List _ * .
bl08065	Fragrant|Fragrant		Fragrant|Fragrant								FOS ROWLANDS ' KAL7SOB I ROWLANDS ' A p F ODONTO .	A Pure , Fragrant , and Non - gritty _ _ Tooth Powder .	WHITENS THE ; rnEETH .
bl08065	smell		peculiar saline|fishy	their garments		in the spare part of the room					And here the coroner sat with the parson and clerk ; while the jury who had been solemnly sworn over the dead body sat on a bench hard by .	A mixed assembly of weather - beaten fishermen , their garments giving out a peculiar saline , fishy smell , crowded together - in the spare part of the room ; while the preventive guard and the watchmen frowned portentously at one of the fishermen who was rash enough to hazard a half - whispered remark .	Sowler was the first witness called .
bl08065	fragrance	a bunch of early violets|their	gentle								Come in , Agnes , dear — you must let me call you Agnes , you know — come in , child , you must be tired after your long and Miss Powys took her up to a cosy little room , furnished in quaint style , the latticed window of which looked far away over the leas and fields suurronding the old fashioned house .	On a table a bunch of early violets , placed there by the tender hearted little woman who helped Agnes to take off her things , spread their gentle fragrance around .	And now I will leave you to Miss Powys said ; do not be down - hearted , my she continued , with a gentle caress , as she saw Agnes ' pained face .
bl08065	smell	the|their	unpleasant								CHAPTER IV .	OST of the houses which existed ninety - six years ago are still standing ; the roughly paved streets , with the open drains , giving out their unpleasant smell , have not been - L t - L altered ; while the old fort , with its heavy walls and moat , and its quaint drawbridge , still frowns over the bay in threatening protection .	Yet the French port of Charette now differs considerably from what it did then .
bl08065	odour	the soup	savoury			from the hearth					This may be my last voyage , and I will then ask you in marriage of your good and Hans shot an amorous glance at her .	When one cannot say anything nice , silence is discreet ; so , with a vigorous pretence of looking after the soup that was giving out a savoury odour from the hearth , Suzanne clattered the wooden spoon into the pot .	But surely , as she leant over it , it was not entirely the fire which caused that deepened flush to mount to her temples .
bl08066	scent	of riot and plunder					the wolves of London			from their dens	Mac nor her companions notice this , so absorbed are they in the fiery conflict before them .	Behind , the wolves of London , drawn from their dens by the scent of riot and plunder , begin to gather in twos and threes , and gangs .	Pasty - faced creatures , with shifty eyes and evil - smelling clothes , whose hair has been cut in many a gaol , but their claws — never .
bl08066	smelling|smelling	clothes	evil - smelling|smelling								Behind , the wolves of London , drawn from their dens by the scent of riot and plunder , begin to gather in twos and threes , and gangs .	Pasty - faced creatures , with shifty eyes and evil - smelling clothes , whose hair has been cut in many a gaol , but their claws — never .	They come and foregather Avith a common instinct , some DICK IS AFRAID 95 mother and our dear calling you I might pick it up — Poll - parrot like ; but it seems like a let - down just now .
bl08066	scent		false				I|he				Lord Wadehurst stumbled on what had actually happened to the girl Goulding , and , misled by some expressions Avhich fell from her in her delirium , sprang to the conclusion that she was Frances Lady Gault .	When he blundered out his assertion assertion that she had been murdered and I knew it , my heart jumped into my mouth ; but almost in the same breath he added ' robbed and murdered , ' and then I knew he was on a false scent .	This faculty of BACK WITH HONOUR 103 She found mother , and gasped : ' He has come — Di — Lord Wadehurst ! ' ' Well , my love , ' mother replied , with provoking calmness , ' go to the drawingroom drawingroom and receive him ; / ' ; ; / not dressed for company , and father has to change his things .
bl08067	smelling	of tan - water									The End of a Busy Life 11 Nor was there anything in the office to account for it .	No empty bottle , no cup or glass , beyond the one smelling of tan - water , to throw light on the grim affair .	He ' s been complaining of his chest lately , said Mrs .
bl08067	aroma		most grateful				the nostrils of the hungry boys				Close enough to the fire to keep its contents warm was a moderate - sized , stout - made iron saucepan .	The man took off the lid , and a most grateful aroma saluted the nostrils of the hungry boys .	Metal platters were brought The Missing Million 44 out , and a hearty meal of stewed river turtle and vegetables was speedily partaken of .
bl08067	sniffed			the air			he				It enabled him to locate the position recently occupied by the peccaries .	Approaching the spot he sniffed the air suspiciously .	suspiciously .
bl08067	scented	blood			of a hound		He				suspiciously .	He had the nostrils of a hound , and scented blood .	He knew when he had arrived at the spot without examining the ground .
bl08067	sniff						the boys				Where ' s Taddy ? inquired Tom .	answered Steady with a sniff ; cut and exclaimed the boys in chorus .	up rough because I objected to his wearing the sarspan as a bell - topper said Steady ; & # 34 ; he ' s likewise let the fire out , but before I got the chance of - ur - postulating with him he was off full Which way did he go ? Over yonder , towards the hills .
bl08067	sniffed|scent			the air			he				There was an eager , restless air about him which he had not shown earlier .	Now and then as he glided along he threw up his head and sniffed the air like a bloodhound on the scent .	And it made John Paton uneasy too , but neither said a word .
bl08067	scent						the				When in doubt he ran about on all fours so much like a hound that it was difficult to think he was entirely human .	But the hound uses scent , and Taddy trusted entirely to his eyesight .	So vast was the arid track , with here and there a small oasis of shrubs and a hollow filled with water , that eleven days expired ere they came to a forest through which they must go .
bl08068	fragrance	Laburnums|The hyacinths									Yet sweet it is to think and see This home is spared by Change ' s hand , With every garden , shrub , and tree Still standing as they used to stand .	Were it not so , and Change should steal Through this loved scene from end to end When all had changed , should I not feel That I had lost another friend ? The lilacs raise their tufts of blue , Laburnums pour their liquid gold , The hyacinths of every hue Breathe fragrance forth a thousandfold A MEMORIAL POEM 17 And if thy creature seem so strong , It is thy strength that he doth prove .	From thee his living breath he drew , And in thy shadow gained his light ; Thy being out of darkness threw This great reflection of thy might .
