Book	Smell_Word	Smell_Source	Quality	Odour_Carrier	Evoked_Odorant	Location	Perceiver	Time	Circumstances	Effect	SentenceBefore	Sentence	SentenceAfter
bl08001	perfume	of the flowers	heavy				She				He is — an interesting man .	' She moved restlessly to the window to let in more air over the heavy perfume of the flowers .	' Well , he is the fashion ; so , of course , one likes to get him .
bl08001	it		sultry					in the early days			There were couches all along and rugs about , while above , through the panes , shone the stars and a crescent moon .	It was hot even here , although the glass was covered by an awning through the day , but it was sultry everywhere in the early days of June .	The windows were open at either end , but the night air only weighed down the evening scent of exotic blooms .
bl08001	scent	of exotic blooms	evening	the night air							It was hot even here , although the glass was covered by an awning through the day , but it was sultry everywhere in the early days of June .	The windows were open at either end , but the night air only weighed down the evening scent of exotic blooms .	Below was the roar of traffic , human 231 The Radical ' s Wife 5c brought his fist down on the table , ' what about that Brut Imperial ? ' ' I have just three bottles left , sir , ' said mine host , obsequiously ; ' they are of worth .
bl08001	scent	of the gardenias	heavy								The dim lamp had struggled with the breaking day , and a garish light burst in on the midnight scene .	Still rose the heavy scent of the gardenias from the bouquet she had worn one night ago ; but the faded heliotrope seemed to wither without the water spilt upon the floor .	About them lay the broken glass of the photo frame , and the portrait pushed aside .
bl08001	liqueurs	coffees									Down on the full tide , with its gentle ripple , that lapped against the Palace walls , gleamed the bright lamps here and there , while in the darkened sky above the stars were glittering , and the moon shone bright on the throng of England ' s chosen .	Here and there the people chattered , and the waiters hurried to and fro with coffees and liqueurs .	In open doorways the whips , known without their hats , still lounged , and around was the perfume of the ' plants ' mixing with that of blossoms worn by the grave and fair .
bl08001	perfume	of the ' plants '			that of blossoms worn by the	In open doorways					Here and there the people chattered , and the waiters hurried to and fro with coffees and liqueurs .	In open doorways the whips , known without their hats , still lounged , and around was the perfume of the ' plants ' mixing with that of blossoms worn by the grave and fair .	' How I love this place ! ' murmured Katherine to Charlie ; ' and people leave it to go to packed drawing - rooms , heated ballrooms , where every idiot can squirl in his neighbour ' s arms .
bl08001	perfume		sweet								288 * 9 The Radical ' s Wife ' It was good of you to bring me these , Gilbert , ' she said .	' I wanted to bring you something like yourself , ' he muttered ; ' deep tone , sweet perfume , harmonious sight .	Ah ! He leaned back and looked all round him , noting every httle detail — the amber cushions on the couches , the white fur rags on the dark - stained floor , the landscape here and there on the yellow walls , the narrow lattice window flung ajar , and the dark green fern bending beneath the August sun .
bl08001	scented|scented	cream - coloured roses|their	sweet|scented|scented								I knew what that was — it is like the word of the dead — and he kept it , too .	It was awfully hard on him , poor fellow , and he did complain conditions were very funny as he took me home ; but I said , Never mind the funnyness , those are the ' Still she stood laugh - ing , playing with the sweet - scented , cream - coloured roses and their deep green leaves .	91 The Radical ' s Wife S » ' You were dreadfully hurt , I am afraid , ' said Katherine , sympathetically .
bl08001	scent|fragrant|fragrant|fragrant	of the fragrant|fragrant|fragrant Manillas	fragrant|fragrant|fragrant	the surrounding surrounding air							It was not cold — it could not be in this raging , hot July ; it was only the welcome freshness of the new - born day .	Katherine leaned back , laughing with all the gaiety of her buoyant heart , while the scent of the fragrant Manillas filled the surrounding surrounding air .	CHAPTER XIII Katherine ' s face was pressed against the grating of the Ladies ' Cage in the House of Commons , and with two ungloved hands she clung to the iron bar in front .
bl08001	fluff|nostrils						them|to their				Now , you know 112 + S The Radical ' s Wife admitted .	It was so much pleasanter for them , sitting on a stool , drawing threads through a machine , the fluff of which was as good as snuff to their nostrils , than to do odd jobs in the open air or in the rooms at home .	It added so much to their importance and well - being to bring grist to the paternal mill , of which they had no part or parcel , but were merely apprentices , many years too young , with the hours of seance childhood sacrificed of these poor beings thrust upon the soil .
bl08001	-|- scented|scented	death|death|hair	death|death -|- scented|scented								' She rose as he extended his broad right hand , and stood and faced him .	A thin , narrow , slender woman , with soiled black gown and ruffled , death - scented hair .	Her eyes , shrunken and pale , were the tint of her shrivelled skin , while the lids stood out , red , swollen and inflamed , burnt with an inward agony , not with tear - drops that bring intense relief .
bl08001	sniff	it					He				' ' Move your chair a httle , Hilda , ' said Katherine , ' or your skirts will get into that wretched Chartreuse ! ' ' At anyrate , Katherine , that will protect you from your bete noir M .	He will sniff it from afar , and stay at the other end of the Terrace .	' ' AVho is Mr M ? One of the new members ? ' ' Yes ; he won Charlie ' s seat ! One for our side , you know ! ' John laughed in his cold , monotonous way .
bl08001	perfume	the bouquet of gardenias	intoxicating								' ' Yes , I daresay , but I would rather see you into your own flat ' 149 The Radical ' s Wife 5c dimpled arms lay against the hard embroidery of her robe .	At her feet lay the bouquet of gardenias , shrivelled , but emitting an intoxicating perfume , while , her gloves wrung off , she trifled with the diamonds on her nervous , long , thin fingers .	Like a very Nana , she smiled in the glass , and her eyes , black in their depths , flashed back on herself .
bl08001	fragrant|fragrant	rose	fragrant|fragrant								Could great fights only be won like this , with the blood of brains , with the weight of human sighs ? Another moment , and she laughed .	A creamy , fragrant rose lay on the stone pillar , its long stem had clambered up , and its green leaves lay beside .	' John was coming that night ; well , it didn ' t matter ! He knew the Labour question was first , and he did not know how widely they diverged on it .
bl08001	smell	of them injens									John James was yarning on , — ' And he drew me aside in a confidential way so that I grew quite alarmed , and began to think the celebrated room had been blown up with dynamite dynamite or something , but he said , Please , sir , we can ' t show it to no ladies to - day .	Fact is , we ' re jist ' avin ' an ' ot pot , and the smell of them injens is something orful ! : ' D ' vision ! ' came like the crack of doom through the night air , and in three seconds the men had vanished , and there was stillness and solitude by the waterside .	Only here and there a man — a guest looking miserably out of place — was left among the women , and under the lamps the sentry tramped up and down .
bl08001	scented	the mass of mauve heliotrope				round her little room	she				Forgive me , my dear boy , for reminding you you are writing to a wife , and one who , so far from wanting your hasn ' t a grain of that commodity to give you .	I gave a love — ' She paused , laid down her pen , and smiled , as she looked round her little room and scented the mass of mauve heliotrope beside her .	' Thank God , yes , ' came a murmur in her heart , ' it is true ! For once in my life these words are but the truth .
bl08001	scented|scented		flower|scented|scented				She				Mr Leighton had left her as she had bidden him , to seek the information for which they hungered .	She was glad to rest alone a moment in that flower - scented , artistic , gaily - peopled hall .	She had her mental society garb on , and , with excitement , was just a little overstrained .
bl08001	breezes		pungent								They sauntered out , Charlie lighting a cigarette for Katherine , as Tony helped himself to the cigars .	It was a fresh , cool night after the burning August day , and light , pungent breezes came over the gorse - covered plain .	Above shone the stars in the clear , dark sky , the only guide they had on the country road by the far - stretching heath .
bl08001	scent	of summer jasmine	Sweeter					after sunset			' They were only trivial sentences , but the lovelight danced in Katherine ' s eyes as she stood by .	Sweeter than the scent of summer jasmine after sunset was the feeling to her soul that he was near .	' Well , I ' m going to take More into the smoking - room .
bl08001	odour	with	good								' ' That man is a capitalist and an ironmaster .	' ' In good odour with his employes — yes .	' ' Do you think Gladstone will befriend the Labour Party ? ' ' I don ' t believe any existing party will help the People ! But if you think I trust Gladstone , you must think me a fool .
bl08001	scented|scented	coffee	strongly - scented|scented								But they made way for her , half civilly , half indifferently , and her mission was soon done .	Springing away from the board covered with large cups of dark , strongly - scented coffee , and edging her way between great frieze - covered elbows and huge shoulders , owned by corduroy - clad men , she proceeded proceeded back more rapidly than she had come .	The streaks of light had widened , and the way , with its slippery gutters , was not so dangerous .
bl08001	savour|smells	it	somewhat earthy								together .	AVhat would you have otherwise ? ' ' I know it is the only way by which people can be together and respectable , which word is supposed to have a godlike savour , though it smells to me somewhat earthy , ' said Katherine , contemptuously ; ' but we are too blind to the want of respectability in people who make each other ' s lives miserable , and probably hate each other , being tied together by the closest and most coercive bond .	' People needn ' t tie themselves together unless they choose .
bl08001	fragrance|perfume	palms|ferns|one or two towering lilies|their|of the moss - hidden violets	almost too heavy		that						26 + 9 The Radical ' s Wife visible between the thick - piled , light - coloured rugs .	No palms or ferns encouraged creeping things , or stood like bazaar articles on old barrels draped in Eastern rags ; but one or two towering lilies mixed their fragrance with that of the moss - hidden violets in a gigantic bowl , which gave a perfume almost too heavy save for the breezes that came through the open - latticed window .	In the midst of this sat the woman — always the woman , no matter who else was by — a part of it , the picture in its frame .
bl08001	scented|scented	April	sweet|scented|scented	air							It was late in the afternoon , when the sun had done its work and the evening breeze made the water ripple and the timid poplars sway .	Looking out on this beauty , drinking in the sweet - scented April air , sat a young woman at an upper , small - paned window .	The room she sat in , though not large , was cool , refreshing , exquisite to the eye .
bl08001	breath|scent	of poppy|of the pink and golden honeysuckle	fading|richer	with the autumn							The burning sun had gone ; it was the late afternoon , before the shades of even .	The dust on the dark green hedgerows had a paler tinge , and a great hush crept over the grainladen grainladen fields , while with the autumn dews came the fading breath of poppy , and the richer scent of the pink and golden honeysuckle that clambered near them across the long grass - grown ditch .	The August evening seemed filled with peace , and Katherine gazed , as in a dream , on the mere wild blossoms in her lap .
bl08001	scent	of the summer roses		the breeze						could carry her away	' existence .	' Katherine looked as if the breeze that brought the scent of the summer roses round her could carry her away .	' You want a complete change .
bl08001	scent	prickles of the gorse bushes					You|all the Northern ' Arries and Arriets				' ' AVhat is that ? ' asked Katherine , with all solemnity .	' My dear Kate , ' he exclaimed ' you in your ignorance might call it H — but it is popularly called The ' Eath ! You ' ll find all the Northern ' Arries and Arriets there enjoying the scent and prickles of the gorse bushes .	' Katherine laughed .
bl08002	fragrant|fragrant	of the incense|a peanut - oil	fragrant|fragrant	smoke							A Avalk through the narrow streets — or rather alleys as Ave would call them , for many are not wider than our sideAvalks — Avould sIioav a sight unusual to Western eyes .	In the early evening the fragrant smoke of the incense arises from the door - shrines ; each place of business has its lantern hanging at the door inscribed with the name of the shop , while in the middle of the street , above the heads of the passers - by , is hung a peanut - oil lamp .	In most of the open shops this oil has given way to American or Russian kerosene .
bl08002	smelling|smelling|smelling|smelling		foul|smelling|smelling foul - smelling|smelling								But when once they get sick the difference between them and ourselves becomes manifest , much to their disadvantage .	Lying on a hard board Avith nothing but a mat beneath him , often in a dark , foul - smelling foul - smelling room , with no sunlight or fresh air , with none of the neatness and quiet that we associate Avith the sick - room , the patient is in a miserable plight .	With a man it is often bad enough , but with a woman it is usually worse .
bl08002	fragrant|fragrant|incense	Avood ( Santalum Pyrularium|their	fragrant|fragrant								In speaking of Chinese emigrants we should not omit those avIio have gone to the Sandwich Islands .	These islands are known to the Chinese as the Wood for this fragrant Avood ( Santalum Pyrularium ) is much valued in China as one of the constituents of their incense as well as the material from which they make carved boxes , paper - knives , etc .	The intercourse bet / ween China and these islands has existed for a century , and so many Chinese have settled there that it was stated a few years ago that the Chinese men Avere more numerous than the native HaAvaiian men ; of course there are more native Avomen , for feAv Chinese Avomen emigrate .
bl08002	stenches	they								that would make a European European ill .	Thus the Embassies to the West have been a factor in China ' s aAvakening , RECONSTRUCTIVE FORCES — CONTINUED .	227 poor are minus everything that makes for comfort or conduces to health , and in times of sickness the condition of the sufferers , especially if they have the misfortune to be women , is extremely The nasal organs of the Chinese seem to be deficient deficient in sensitiveness , and they endure with apparent apparent impunity stenches that would make a European European ill .	Many of their rooms are dark and damp .
bl08002	foul|foul	The sewers	foul|foul			in the cities					Many of their rooms are dark and damp .	The sewers in the cities are frequently foul , and often , through superstitious notions , are so constructed constructed that the sewage collects in them instead of floAving off .	Most of the villages in South China O O have pools into Avhich all refuse matter is cast .
bl08003	odour	of hay or oats	stray	the wind			to their wide nostrils				They reached at last the ascent from the parish road to Castle Warlock .	This was so steep that their conductors , though they held no conference on the subject , were both anxious as to the behaviour of the horses ; but the moment their heads came round , whether only that it w * as another turn with its fresh hope , or that the wind brought some stray odour of hay or oats to their wide nostrils , I cannot tell , but finding the ground tolerably clear , they took the brae with a wiU , and tore up with the last efforts of a strength all but exhausted , Cosmo and Aggie running beside them , and talking to them all the way .	The only difficulty was to make the lad on the box give them head enough .
bl08003	smelling	of earth and decaying wood		the cold , damp air							A wooden chair stood in the middle of the room , and on it a bottle and teacup ; not another article was visible .	Under the hole in the ceiling a hole was rotted in the floor , and the cold , damp air , smelling of earth and decaying wood , that filled the place , must come up there , he thought A few minutes ' rest and he would rise 1 He must come to himself a little first 1 — Now he THE LUMINOUS NIGHT .	161 He would not have us think we know him before we do .
bl08003	stinks|nose						his				My lord ne ' er sets his nose intil the gairden , or speirs — no ance in a twalmonth — hoo things is gangin ' on .	He dis naething but rowt aboot in ' s boaratory , as he oa ' s ' t — bore - a - whig or bore - a - tory , it ' s little to me ! — makin ' stinks fit to scomfish a whaul , an ' gar ' im stick his nose ' aneth the watter to get a glamp o ' fresh air .	He ' s that hard - hertit he never sae muckle as chows his denner anent his ain sister ' cep ' whan he has company an ' wad luik like ither fowk .
bl08003	scent|odour	of|from the oakbark oakbark|of burning peat	strong	the air			he	Now			As Cosmo passed along , he saw every craftsman in the place at work ; from blacksmith to tailor all were busy .	Now and then he was met by a strong scent , as of burning leather , from the oakbark oakbark which , after its astringent power had been exhausted in the tanpit some of the housewives used for fuel ; but mostly the air was filled with the odour of burning peat .	He knew almost everybody , and was kindly greeted as he went along — nor the less that some of them , when they heard he was not at school the day before , had remarked that his birthday hardly brought him enough to keep it with .
bl08003	scent|nostrils	of the flowers					he|his|his				The sky was a region of endless hopes and ever recurrent recurrent despairs ; that the beloved earthly thing should rise there , gave him one homely fact concerning the unknown and appalling .	But from the sky he was sent back to the earth in yet farther pursuit ; for whence came the rain , as his books told him , but from the sea ? The sea he had read of , though never yet beheld , and he knew it magnificent ; gladly , as he thought with himself under the wall , would he have hailed it an intermediate betwixt the sky and the earth , with the sky coming first , but , alas , the sea was before the sky in the order of the stream ' s genesis 1 And then , worse and worse ! how was the ocean fed but from the torrent ? How was the sky fed but from the ocean ? How was the dark fountain fed but from the sky ? How was the torrent fed but from the fountain ? As he sat in the hot garden , leaning against the old gray castle , the nest of his family for countless generations , with the scent of the flowers in his nostrils , and the sound of the bees in his ears , he became aware that he had lost the stream of his childhood — the mysterious , infinite idea of endless , inexplicable , original birth , of outflowing because of essential essential existence within .	There was no production any more , nothing but the merest rushing around , like the ring - sea of Saturn , in a never ending circle of formal change ! Like a great dish , the mighty ocean was skimmed in particles invisible ; these were gathered aloft into sponges all water and no sponge ; and thence through many an airy , many an earthly channel , deflowered of its mystery , his ancient , self - producing fountain to a holy , merry river , was fed — only fed I It was but a cistern after all ! He grew very sad , and well he might .
bl08003	snuff|smelt	a few|of something|of opium									There were three of them , each forming a small box .	In the first were a few grains of snuff , in the second a little of something that looked like gold dust , and the third smelt of opium .	The top of the cane had a cap of silver , with a screw ; this went into the lower part of the horse , and made of it a crutch - handle to the stick .
bl08003	scents	of the flowers					his				thought he , if their honey is sweet to them with the same sweetness with which it is sweet to me , then there is something in the make of the bee that ' s the same with the make of me ; and perhaps a man might some day , if he wanted , try the taste of being a bee all But to see him , nobody would have thought he was doing anything but basking in the sun .	The scents of the flowers about his feet came borne on the eddies of the air , and paid my lord many a visit in the ante - chamber , his brain ; the windy noises of the insects , the watery noises of the pigeons , the family noises from the poultry - yard , the rushing song of the mountain mountain river , all visited him through the portals of his ears ; but at the moment the boy seemed lost , not in thought as was the fact , but in the fundamental enjoyment of mere existence .	Neither , although broad summer was on the earth , and all the hill - tops and as much of the valleys as their shadows did not hide were bathed in sunlight , although the country was his native land , V 84 A List of TRENCH , Archbishop .
bl08003	reek	herts|licht									O my God , latna the sunshiny Mammon creep intil my Cosmo ' s hert an ' mak a ' mirk ; latna the licht that is in him turn to darkness .	God hae mercy on his bairns , an ' no lat the playocks tak their e ' en frae the han ' ' at gies them ! May the licht noo streamin ' frae the hert o ' thae bonny stanes be the bodily presence o ' thy speerit , as ance was the doo descendin ' upo ' the maister , an ' the buss ' at burned wi ' fire an ' wasna conshumet Thoo art the father o ' lichts , an ' a ' licht is thine : gar oor herts burn like thae stanes — a ' licht an ' nae reek ! An ' gien ony o ' them in auld time cam in by a wrang door , grant ilk ane to gang oot by a richt ane .	Thy wull be dune , which is the purifyin ' fire o ' a ' thing , an ' a ' sowl ! THE CASTLE INN .
bl08003	aroma		much			here					Lord Mergwain listened to the glug - glug in the long neck of the decanter as a lover might to a song of love , and the moment it ceased was holding the glass to his nose .	Humph ! not much aroma here ! he grumbled .	I ought A REST .
bl08003	scent|scent	of the homely flowers|their		It		on the chimney - piece					But what ! was I traitor enough to call such a dinner a poor one ! Truth and Scotland forgive ' me , for I know none so good ? And after dinner — immediately , for the laird had long ago given up his toddy — they went to the drawingroom , drawingroom , an altogether pleasant place now in the summer .	It was full of the scent of the homely flowers Grizzie had stuck in the old vases on the chimney - piece , and their scent harmonized strangely with the slow - vanishing colours of the room .	The laird laid himself himself down on the brocade - covered sofa , and Cosmo sat close beside him on a low chair , and talked , and told him this and that , and read to him , till at last the old man fell asleep , and then Cosmo , having softly spread a covering over him , sat brooding upon things sad yet pleasant , until he too fell asleep , and went to Joan in his dreams .
bl08003	odours		evanescent								He had never save in his dreams felt the radiance of beauty ; and never a dream had shone like the reality that now folded him in bliss .	For isolating winter stretched miles and miles around the old paradise of his mother ' s drawing - room , where , in the glowing twilight of a flamy fire , whose shadows flickered at their wild will over all the magic room , he sat at the feet of a lady , with eyes black as night , but alive with a radiance no sun could kindle , with a hand like warm snow , in garments lovely as the clouds that clothe a sunset , who inhabited an atmosphere of evanescent odours , each a dream from beyond the stars , while the darkness that danced with the firelight played endless variations on the theme of her beauty .	Long had he sat lost in the dream - haunted gorgeous silence , when suddenly he bethought himself of his duty towards his heavenly visitant .
bl08003	stinks						he				189 She gangs whiles to the doctor ' s .	He ' s a kin ' o ' a freen ' o ' the yerl ' s : he likes stinks .	That ' s the yoong doctor , I Does the earl never take her with him anywhere AA ' haur sud that be ? There ' s naebody cares a bodle aboot his lordship i ' the haill country - side .
